{
  "schema_version": "work_order.v1",
  "id": "auto-revert-bisect",
  "title": "Auto-revert + local bisect on canary failures; emit fix work orders",
  "status": "pending",
  "depends_on": ["repo-integration-bot", "canary-runner"],
  "goal": "When canary fails, automatically revert the breaking change and run a local bisect to identify the culprit, then emit a fix work order.",
  "acceptance": {
    "gates": [
      {
        "id": "placeholder",
        "type": "custom",
        "cmd": "python -c \"print('auto-revert-bisect: placeholder gate (will be replaced)')\"",
        "timeout_seconds": 10
      }
    ]
  },
  "steps": [
    "Implement revert automation based on the last merged commit range.",
    "Implement git bisect automation integrated with the canary runner.",
    "Emit a new WorkOrder with a minimal reproduction and required regression test."
  ],
  "rollback": {
    "strategy": "Disable auto-revert and revert bisect automation scripts."
  },
  "created_at": "2026-01-02T00:00:00Z",
  "updated_at": "2026-01-02T00:00:00Z"
}


